Модальность,Уровень 1,Уровень 2,Уровень 3,Вектор
,овца,descriptions/овца_description_9.txt,короткая плотная белая черные ноги,descriptions/овца_description_vector_9.txt
,овца,descriptions/овца_description_10.txt,белая черная средний мощный,descriptions/овца_description_vector_10.txt
,овца,descriptions/овца_description_11.txt,густая курчавая мощные уши,descriptions/овца_description_vector_11.txt
,овца,descriptions/овца_description_12.txt,короткая густая белая черная,descriptions/овца_description_vector_12.txt
,овца,descriptions/овца_description_13.txt,плотная мягкая белая коричневые отметины,descriptions/овца_description_vector_13.txt
,овца,descriptions/овца_description_14.txt,многоцветная чернобелая маска изящный,descriptions/овца_description_vector_14.txt
,овца,descriptions/овца_description_15.txt,черная белая черные ноги,descriptions/овца_description_vector_15.txt
,овца,descriptions/овца_description_16.txt,белая черная морда мощные ноги,descriptions/овца_description_vector_16.txt
,овца,descriptions/овца_description_17.txt,короткая густая белая черные отметины,descriptions/овца_description_vector_17.txt
,овца,descriptions/овца_description_18.txt,короткая густая белая черная маска,descriptions/овца_description_vector_18.txt
,овца,descriptions/овца_description_19.txt,короткая плотная белая черные отметины,descriptions/овца_description_vector_19.txt
,овца,descriptions/овца_description_20.txt,густая мягкая белая черные отметины,descriptions/овца_description_vector_20.txt
,овца,descriptions/овца_description_21.txt,густая серая черные отметины,descriptions/овца_description_vector_21.txt
,овца,descriptions/овца_description_22.txt,короткая густая белая черные отметины,descriptions/овца_description_vector_22.txt
,овца,descriptions/овца_description_23.txt,черная белая черные отметины,descriptions/овца_description_vector_23.txt
,овца,descriptions/овца_description_24.txt,короткая густая белая черные отметины,descriptions/овца_description_vector_24.txt
,овца,descriptions/овца_description_25.txt,короткая плотная белая черные отметины,descriptions/овца_description_vector_25.txt
,овца,descriptions/овца_description_26.txt,черная черные отметины,descriptions/овца_description_vector_26.txt
,овца,descriptions/овца_description_27.txt,короткая густая белая черные отметины,descriptions/овца_description_vector_27.txt
,овца,descriptions/овца_description_28.txt,черная белая черные отметины,descriptions/овца_description_vector_28.txt
,овца,descriptions/овца_description_29.txt,крупные короткая густая белая черные отметины,descriptions/овца_description_vector_29.txt
,овца,descriptions/овца_description_30.txt,мягкая густая белая черные отметины,descriptions/овца_description_vector_30.txt
