Модальность,Уровень 1,Уровень 2,Уровень 3,Вектор
,собака,descriptions/собака_description_29.txt,маленькая крепкая короткие лапы длинное тело рыжий черный подпалом палевый трехцветный окрас,descriptions/собака_description_vector_29.txt
,собака,descriptions/собака_description_30.txt,маленькая длинная шерсть золотой белый черный серый окрас выразительные глаза,descriptions/собака_description_vector_30.txt
,осел,descriptions/осел_description_1.txt,средний размер крепкое телосложение прямые ноги серый черная полоса крестообразная отметина,descriptions/осел_description_vector_1.txt
,осел,descriptions/осел_description_2.txt,крупный длинные уши густая шерсть серый темнокоричневый,descriptions/осел_description_vector_2.txt
,осел,descriptions/осел_description_3.txt,средний размер плотная шерсть серый коричневый,descriptions/осел_description_vector_3.txt
,осел,descriptions/осел_description_4.txt,крупный длинные ноги короткая шерсть светлокоричневый серый,descriptions/осел_description_vector_4.txt
,осел,descriptions/осел_description_5.txt,крупный длинные уши густая шерсть черный темнокоричневый,descriptions/осел_description_vector_5.txt
,осел,descriptions/осел_description_6.txt,средний размер гладкая шерсть светлосерый коричневый,descriptions/осел_description_vector_6.txt
,осел,descriptions/осел_description_7.txt,крупный густая шерсть черный темнокоричневый,descriptions/осел_description_vector_7.txt
,осел,descriptions/осел_description_8.txt,крупный короткая шерсть черный серый,descriptions/осел_description_vector_8.txt
,осел,descriptions/осел_description_9.txt,средний размер гладкая шерсть серый коричневый,descriptions/осел_description_vector_9.txt
,осел,descriptions/осел_description_10.txt,крупный плотная шерсть серый коричневый,descriptions/осел_description_vector_10.txt
,осел,descriptions/осел_description_11.txt,средний размер короткая шерсть светлокоричневый серый,descriptions/осел_description_vector_11.txt
,осел,descriptions/осел_description_12.txt,маленький короткая шерсть серый коричневый,descriptions/осел_description_vector_12.txt
,осел,descriptions/осел_description_13.txt,средний размер короткая шерсть серый коричневый,descriptions/осел_description_vector_13.txt
,осел,descriptions/осел_description_14.txt,крупный гладкая шерсть светлокоричневый серый,descriptions/осел_description_vector_14.txt
,осел,descriptions/осел_description_15.txt,средний размер короткая шерсть серый коричневый,descriptions/осел_description_vector_15.txt
,осел,descriptions/осел_description_16.txt,крупный гладкая шерсть светлокоричневый серый,descriptions/осел_description_vector_16.txt
,осел,descriptions/осел_description_17.txt,средний размер короткая шерсть серый коричневый,descriptions/осел_description_vector_17.txt
,осел,descriptions/осел_description_18.txt,крупный плотная шерсть черный темнокоричневый,descriptions/осел_description_vector_18.txt
,осел,descriptions/осел_description_19.txt,средний размер короткая шерсть светлокоричневый серый,descriptions/осел_description_vector_19.txt
,осел,descriptions/осел_description_20.txt,крупный короткая шерсть черный темнокоричневый,descriptions/осел_description_vector_20.txt
,осел,descriptions/осел_description_21.txt,средний размер короткая шерсть серый коричневый,descriptions/осел_description_vector_21.txt
,осел,descriptions/осел_description_22.txt,средний размер плотная шерсть серый коричневый,descriptions/осел_description_vector_22.txt
,осел,descriptions/осел_description_23.txt,средний размер короткая шерсть серый коричневый,descriptions/осел_description_vector_23.txt
,осел,descriptions/осел_description_24.txt,крупный плотная шерсть черный темнокоричневый,descriptions/осел_description_vector_24.txt
,осел,descriptions/осел_description_25.txt,средний размер короткая шерсть серый коричневый,descriptions/осел_description_vector_25.txt
,осел,descriptions/осел_description_26.txt,маленький короткая шерсть серый коричневый,descriptions/осел_description_vector_26.txt
,осел,descriptions/осел_description_27.txt,маленький короткая шерсть серый коричневый,descriptions/осел_description_vector_27.txt
,осел,descriptions/осел_description_28.txt,средний размер короткая шерсть серый коричневый,descriptions/осел_description_vector_28.txt
,осел,descriptions/осел_description_29.txt,средний размер короткая шерсть серый коричневый,descriptions/осел_description_vector_29.txt
,осел,descriptions/осел_description_30.txt,крупный короткая шерсть серый коричневый,descriptions/осел_description_vector_30.txt
,лягушка,descriptions/лягушка_description_1.txt,маленькие белоснежная темные глаза плоское короткие,descriptions/лягушка_description_vector_1.txt
,лягушка,descriptions/лягушка_description_2.txt,яркожелтые глаза зеленоватокоричневая узкое длинные,descriptions/лягушка_description_vector_2.txt
,лягушка,descriptions/лягушка_description_3.txt,крошечная пестрый вытянутый яркие пятна короткие,descriptions/лягушка_description_vector_3.txt
,лягушка,descriptions/лягушка_description_4.txt,крупная плотное широкая зеленоватокоричневая темные полосы,descriptions/лягушка_description_vector_4.txt
,лягушка,descriptions/лягушка_description_5.txt,яркокрасная черные окраска короткие длинные лапки,descriptions/лягушка_description_vector_5.txt
,лягушка,descriptions/лягушка_description_6.txt,маленькая белая яркие оранжевые глаза пузырьковая,descriptions/лягушка_description_vector_6.txt
,лягушка,descriptions/лягушка_description_7.txt,коричневая обрывок тело широкие плавательные лапки,descriptions/лягушка_description_vector_7.txt
,лягушка,descriptions/лягушка_description_8.txt,яркозеленые золотистые глаза широкое плавательные пальцы,descriptions/лягушка_description_vector_8.txt
,лягушка,descriptions/лягушка_description_9.txt,песочнокоричневая мелкие черные глаза плоское длинные,descriptions/лягушка_description_vector_9.txt
,лягушка,descriptions/лягушка_description_10.txt,яркооранжевая черные полосы узкое длинные,descriptions/лягушка_description_vector_10.txt
,лягушка,descriptions/лягушка_description_11.txt,крупная металлически блестящей коричневого массивные лапки,descriptions/лягушка_description_vector_11.txt
,лягушка,descriptions/лягушка_description_12.txt,черная глянцевая короткие передние лапки,descriptions/лягушка_description_vector_12.txt
,лягушка,descriptions/лягушка_description_13.txt,коричневая пятна землистого круглое мощные лапки,descriptions/лягушка_description_vector_13.txt
,лягушка,descriptions/лягушка_description_14.txt,узкое длинные плавательные пальцы мягкая гладкая,descriptions/лягушка_description_vector_14.txt
,лягушка,descriptions/лягушка_description_15.txt,серебристосерая крупные черные глаза мощные широкие,descriptions/лягушка_description_vector_15.txt
,лягушка,descriptions/лягушка_description_16.txt,голубая светлосерые узкое вытянутое глаза,descriptions/лягушка_description_vector_16.txt
,лягушка,descriptions/лягушка_description_17.txt,разноцветные пятна круглые глаза гибкие лапки,descriptions/лягушка_description_vector_17.txt
,лягушка,descriptions/лягушка_description_18.txt,маленькая кремовобелая яркоголубые плавательные мембраны,descriptions/лягушка_description_vector_18.txt
,лягушка,descriptions/лягушка_description_19.txt,коричневая зеленые мелкие округлые пятна,descriptions/лягушка_description_vector_19.txt
,лягушка,descriptions/лягушка_description_20.txt,белая коричневая плоское мелкие черные глаза,descriptions/лягушка_description_vector_20.txt
,лягушка,descriptions/лягушка_description_21.txt,маленькая оранжевые черные зеленые глаза плавательные,descriptions/лягушка_description_vector_21.txt
,лягушка,descriptions/лягушка_description_22.txt,голубоватосерая множество мелких шипов круглые глаза,descriptions/лягушка_description_vector_22.txt
,лягушка,descriptions/лягушка_description_23.txt,кремовобелая яркоголубые глаза плавательные мембраны,descriptions/лягушка_description_vector_23.txt
,лягушка,descriptions/лягушка_description_24.txt,голубоватая желтые глаза плоское широкое,descriptions/лягушка_description_vector_24.txt
,лягушка,descriptions/лягушка_description_25.txt,серебристосерая крупные золотистые глаза мощные широкие,descriptions/лягушка_description_vector_25.txt
,лягушка,descriptions/лягушка_description_26.txt,зеленоватокоричневая черные пятна гладкая блестящая,descriptions/лягушка_description_vector_26.txt
,лягушка,descriptions/лягушка_description_27.txt,золотистожелтая черные глаза плоское широкое,descriptions/лягушка_description_vector_27.txt
,лягушка,descriptions/лягушка_description_28.txt,разноцветные пятнистый мелкие округлые глаза,descriptions/лягушка_description_vector_28.txt
,лягушка,descriptions/лягушка_description_29.txt,зеленоватокоричневая тонкая длинная мордочка плавательные мембраны,descriptions/лягушка_description_vector_29.txt
,лягушка,descriptions/лягушка_description_30.txt,коричневая яркие пятна пушистые глаза,descriptions/лягушка_description_vector_30.txt
,лев,descriptions/лев_description_1.txt,крупный густая красноватожелтая грива мощная морда,descriptions/лев_description_vector_1.txt
,лев,descriptions/лев_description_2.txt,крупный густая коричневожелтая грива пышная,descriptions/лев_description_vector_2.txt
,лев,descriptions/лев_description_3.txt,крупный темная густая пышная голова морда,descriptions/лев_description_vector_3.txt
,лев,descriptions/лев_description_4.txt,крупный яркая золотистожелтая пышная морда,descriptions/лев_description_vector_4.txt
,лев,descriptions/лев_description_5.txt,крупный короткая золотистожелтая густая пышная,descriptions/лев_description_vector_5.txt
,лев,descriptions/лев_description_6.txt,массивный короткая золотистожелтая морда,descriptions/лев_description_vector_6.txt
,лев,descriptions/лев_description_7.txt,крупный короткая золотистожелтая пышная вытянутая,descriptions/лев_description_vector_7.txt
,лев,descriptions/лев_description_8.txt,крупный короткая золотистожелтая пышная морда,descriptions/лев_description_vector_8.txt
,лев,descriptions/лев_description_9.txt,крупный короткая золотистожелтая пышная выразительная,descriptions/лев_description_vector_9.txt
,лев,descriptions/лев_description_10.txt,крупный грациозный короткая золотистожелтая пышная,descriptions/лев_description_vector_10.txt
,лев,descriptions/лев_description_11.txt,крупный короткая золотистожелтая пышная мощная,descriptions/лев_description_vector_11.txt
,лев,descriptions/лев_description_12.txt,крупный короткая золотистожелтая пышная мощная,descriptions/лев_description_vector_12.txt
,лев,descriptions/лев_description_13.txt,крупный мускулистый пышная золотистожелтая,descriptions/лев_description_vector_13.txt
,лев,descriptions/лев_description_14.txt,крупный величественный короткая золотистожелтая раскидистая,descriptions/лев_description_vector_14.txt
,лев,descriptions/лев_description_15.txt,крупный массивный короткая золотистожелтая пышная,descriptions/лев_description_vector_15.txt
,лев,descriptions/лев_description_16.txt,крупный мощный короткая золотистожелтая пышная,descriptions/лев_description_vector_16.txt
,лев,descriptions/лев_description_17.txt,крупный грациозный короткая золотистожелтая пышная,descriptions/лев_description_vector_17.txt
,лев,descriptions/лев_description_18.txt,крупный мощный короткая золотистожелтая пышная,descriptions/лев_description_vector_18.txt
,лев,descriptions/лев_description_19.txt,крупный грациозный короткая золотистожелтая пышная,descriptions/лев_description_vector_19.txt
,лев,descriptions/лев_description_20.txt,крупный мускулистый короткая золотистожелтая пышная,descriptions/лев_description_vector_20.txt
,лев,descriptions/лев_description_21.txt,крупный величественный короткая золотистожелтая раскидистая,descriptions/лев_description_vector_21.txt
,лев,descriptions/лев_description_22.txt,крупный мощный короткая золотистожелтая пышная,descriptions/лев_description_vector_22.txt
,лев,descriptions/лев_description_23.txt,крупный мускулистый короткая золотистожелтая густая,descriptions/лев_description_vector_23.txt
,лев,descriptions/лев_description_24.txt,крупный величественный короткая золотистожелтая разветвленная,descriptions/лев_description_vector_24.txt
,лев,descriptions/лев_description_25.txt,крупный грациозный короткая золотистожелтая раскидистая,descriptions/лев_description_vector_25.txt
,лев,descriptions/лев_description_26.txt,крупный мускулистый короткая золотистожелтая объемная,descriptions/лев_description_vector_26.txt
,лев,descriptions/лев_description_27.txt,крупный грациозный короткая золотистожелтая разветвленная,descriptions/лев_description_vector_27.txt
,лев,descriptions/лев_description_28.txt,крупный величественный короткая золотистожелтая пышная,descriptions/лев_description_vector_28.txt
,лев,descriptions/лев_description_29.txt,крупный мощный короткая золотистожелтая объемная,descriptions/лев_description_vector_29.txt
,лев,descriptions/лев_description_30.txt,крупный величественный короткая золотистожелтая пышная,descriptions/лев_description_vector_30.txt
,обезьяна,descriptions/обезьяна_description_1.txt,крупные черный мех лицо сильные передние,descriptions/обезьяна_description_vector_1.txt
,обезьяна,descriptions/обезьяна_description_2.txt,крупные массивный торс сильные конечности гребень,descriptions/обезьяна_description_vector_2.txt
,обезьяна,descriptions/обезьяна_description_3.txt,длинные красноватый мех руки мордочка выраженный,descriptions/обезьяна_description_vector_3.txt
,обезьяна,descriptions/обезьяна_description_4.txt,длинные короткие тела мех различные оттенки,descriptions/обезьяна_description_vector_4.txt
,обезьяна,descriptions/обезьяна_description_5.txt,средние короткий широко раздвигающиеся ноздри хвост,descriptions/обезьяна_description_vector_5.txt
,обезьяна,descriptions/обезьяна_description_6.txt,длинные темный мех мордочка грациозный взгляд,descriptions/обезьяна_description_vector_6.txt
,обезьяна,descriptions/обезьяна_description_7.txt,маленькие яркий мех глаза пестрые узоры,descriptions/обезьяна_description_vector_7.txt
,обезьяна,descriptions/обезьяна_description_8.txt,узкие длинные хвост мех разнообразных оттенков,descriptions/обезьяна_description_vector_8.txt
,обезьяна,descriptions/обезьяна_description_9.txt,маленькие тонкие конечности длинный хвост серый,descriptions/обезьяна_description_vector_9.txt
,обезьяна,descriptions/обезьяна_description_10.txt,маленькие короткий мех выразительные пятна лицо,descriptions/обезьяна_description_vector_10.txt
,обезьяна,descriptions/обезьяна_description_11.txt,крупные густый мех массивный мордочка уши,descriptions/обезьяна_description_vector_11.txt
,обезьяна,descriptions/обезьяна_description_12.txt,длинные мордочки зубы черные глаза короткие,descriptions/обезьяна_description_vector_12.txt
,обезьяна,descriptions/обезьяна_description_13.txt,длинные шершавые мордочки белые круглые пятна,descriptions/обезьяна_description_vector_13.txt
,обезьяна,descriptions/обезьяна_description_14.txt,длинные изогнутые хвосты мех яркие цветные,descriptions/обезьяна_description_vector_14.txt
,обезьяна,descriptions/обезьяна_description_15.txt,крупные пушистый мех черные глаза белый,descriptions/обезьяна_description_vector_15.txt
,обезьяна,descriptions/обезьяна_description_16.txt,крупные короткий мех выступающие скулы острые,descriptions/обезьяна_description_vector_16.txt
,обезьяна,descriptions/обезьяна_description_17.txt,маленькие пушистый мех сероватобелый лицо глаза,descriptions/обезьяна_description_vector_17.txt
,обезьяна,descriptions/обезьяна_description_18.txt,длинные изогнутые хвосты маленькие глаза мех,descriptions/обезьяна_description_vector_18.txt
,обезьяна,descriptions/обезьяна_description_19.txt,маленькие короткий мех яркие глаза белый,descriptions/обезьяна_description_vector_19.txt
,обезьяна,descriptions/обезьяна_description_20.txt,маленькие мягкий пушистый мех лицо гибкие,descriptions/обезьяна_description_vector_20.txt
,обезьяна,descriptions/обезьяна_description_21.txt,короткий мех выразительные глаза серый черный,descriptions/обезьяна_description_vector_21.txt
,обезьяна,descriptions/обезьяна_description_22.txt,длинные изогнутые хвосты короткий мех мордочка,descriptions/обезьяна_description_vector_22.txt
,обезьяна,descriptions/обезьяна_description_23.txt,маленькие короткий мех острый черты лица,descriptions/обезьяна_description_vector_23.txt
,обезьяна,descriptions/обезьяна_description_24.txt,густый вьющийся мех длинные изогнутые хвосты,descriptions/обезьяна_description_vector_24.txt
,обезьяна,descriptions/обезьяна_description_25.txt,маленькие пушистый мех яркие глаза серый,descriptions/обезьяна_description_vector_25.txt
,обезьяна,descriptions/обезьяна_description_26.txt,гибкие мускулистые конечности пушистый мех лицо,descriptions/обезьяна_description_vector_26.txt
,обезьяна,descriptions/обезьяна_description_27.txt,маленькие густый мех круглые глаза серый,descriptions/обезьяна_description_vector_27.txt
,обезьяна,descriptions/обезьяна_description_28.txt,крупные толстый складчатый мех длинные уши,descriptions/обезьяна_description_vector_28.txt
,обезьяна,descriptions/обезьяна_description_29.txt,маленькие короткий мех яркие глаза разнообразных,descriptions/обезьяна_description_vector_29.txt
,обезьяна,descriptions/обезьяна_description_30.txt,длинные гибкие конечности короткий мех выразительные,descriptions/обезьяна_description_vector_30.txt
,овца,descriptions/овца_description_1.txt,мягкая густая складки белоснежная,descriptions/овца_description_vector_1.txt
,овца,descriptions/овца_description_2.txt,черная лицо средний мощный,descriptions/овца_description_vector_2.txt
,овца,descriptions/овца_description_3.txt,крупные белый мертвеннобелый голова морда,descriptions/овца_description_vector_3.txt
,овца,descriptions/овца_description_4.txt,короткая плотная белая черное морда ноги,descriptions/овца_description_vector_4.txt
,овца,descriptions/овца_description_5.txt,длинная густая шерсть голова шея длинные уши,descriptions/овца_description_vector_5.txt
,овца,descriptions/овца_description_6.txt,густая блестящая выраженная грива шея,descriptions/овца_description_vector_6.txt
,овца,descriptions/овца_description_7.txt,короткая гладкая черный морда мощные,descriptions/овца_description_vector_7.txt
,овца,descriptions/овца_description_8.txt,черная мощный выразительный черные глаза,descriptions/овца_description_vector_8.txt
